{
  "$schema": "https://json-schema.org/draft/2020-12/schema",
  "$id": "https://ep-wiki.local/schemas/gear-set-localization.schema.json",
  "title": "EP-WIKI localized gear set overlay",
  "type": "object",
  "additionalProperties": false,
  "required": ["schemaVersion", "entityType", "entityId", "locale", "source", "identity", "effects", "sourceAnomalies"],
  "properties": {
    "schemaVersion": { "const": "1.0.0" },
    "entityType": { "const": "gear_set" },
    "entityId": { "type": "string", "pattern": "^[a-z0-9_]+$" },
    "locale": { "enum": ["ko-KR", "en-US", "ja-JP", "zh-TW"] },
    "source": {
      "type": "object",
      "additionalProperties": false,
      "required": ["provider", "url", "htmlLang", "xmlLang", "observedAt"],
      "properties": {
        "provider": { "const": "wiki.skport.com" },
        "url": { "type": "string", "format": "uri" },
        "htmlLang": { "type": "string", "minLength": 1 },
        "xmlLang": { "type": "string", "minLength": 1 },
        "observedAt": { "type": "string", "format": "date-time" }
      }
    },
    "identity": {
      "type": "object",
      "additionalProperties": false,
      "required": ["name"],
      "properties": { "name": { "type": "string", "minLength": 1 } }
    },
    "effects": {
      "type": "array",
      "minItems": 1,
      "items": {
        "type": "object",
        "additionalProperties": false,
        "required": ["id", "sourceLabel", "description"],
        "properties": {
          "id": { "type": "string", "pattern": "^[a-z0-9_.]+$" },
          "sourceLabel": { "type": "string", "minLength": 1 },
          "description": { "type": "string", "minLength": 1 }
        }
      }
    },
    "sourceAnomalies": {
      "type": "array",
      "items": {
        "type": "object",
        "additionalProperties": false,
        "required": ["path", "kind"],
        "properties": {
          "path": { "type": "string", "minLength": 1 },
          "kind": { "type": "string", "minLength": 1 },
          "sourceText": { "type": "string" },
          "note": { "type": "string" }
        }
      }
    }
  }
}
